{
  "$schema": "http://json-schema.org/draft-07/schema#",
  "$id": "https://adjective.us/prelude/schemas/v1/constraints.schema.json",
  "title": "Prelude Constraints Schema",
  "description": "Schema for Prelude constraints.json file containing development rules and preferences",
  "type": "object",
  "properties": {
    "$schema": {
      "type": "string",
      "description": "URI of the JSON Schema for this file",
      "format": "uri"
    },
    "version": {
      "type": "string",
      "description": "Semantic version of Prelude format",
      "pattern": "^\\d+\\.\\d+\\.\\d+$"
    },
    "mustUse": {
      "type": "array",
      "description": "Required technologies or practices",
      "items": {
        "type": "string"
      }
    },
    "mustNotUse": {
      "type": "array",
      "description": "Prohibited technologies or practices",
      "items": {
        "type": "string"
      }
    },
    "preferences": {
      "type": "array",
      "description": "Preferred approaches with rationale",
      "items": {
        "type": "object",
        "required": ["category", "preference"],
        "properties": {
          "category": {
            "type": "string",
            "description": "Category of preference"
          },
          "preference": {
            "type": "string",
            "description": "Preferred approach"
          },
          "rationale": {
            "type": "string",
            "description": "Reason for preference"
          }
        }
      }
    },
    "codeStyle": {
      "type": "object",
      "description": "Code style configuration",
      "properties": {
        "formatter": {
          "type": "string",
          "description": "Code formatter (e.g., Prettier)"
        },
        "linter": {
          "type": "string",
          "description": "Code linter (e.g., ESLint)"
        },
        "rules": {
          "type": "array",
          "description": "Linting rules or configurations",
          "items": {
            "type": "string"
          }
        }
      }
    },
    "naming": {
      "type": "object",
      "description": "Naming conventions",
      "properties": {
        "files": {
          "type": "string",
          "description": "File naming convention"
        },
        "components": {
          "type": "string",
          "description": "Component naming convention"
        },
        "functions": {
          "type": "string",
          "description": "Function naming convention"
        },
        "variables": {
          "type": "string",
          "description": "Variable naming convention"
        }
      }
    },
    "fileOrganization": {
      "type": "array",
      "description": "File organization rules",
      "items": {
        "type": "string"
      }
    },
    "testing": {
      "type": "object",
      "description": "Testing requirements",
      "properties": {
        "required": {
          "type": "boolean",
          "description": "Whether testing is required"
        },
        "coverage": {
          "type": "number",
          "description": "Required test coverage percentage",
          "minimum": 0,
          "maximum": 100
        },
        "strategy": {
          "type": "string",
          "description": "Testing strategy description"
        }
      }
    },
    "documentation": {
      "type": "object",
      "description": "Documentation requirements",
      "properties": {
        "required": {
          "type": "boolean",
          "description": "Whether documentation is required"
        },
        "style": {
          "type": "string",
          "description": "Documentation style or format"
        }
      }
    },
    "performance": {
      "type": "array",
      "description": "Performance constraints",
      "items": {
        "type": "string"
      }
    },
    "security": {
      "type": "array",
      "description": "Security requirements",
      "items": {
        "type": "string"
      }
    },
    "accessibility": {
      "type": "array",
      "description": "Accessibility requirements",
      "items": {
        "type": "string"
      }
    }
  },
  "additionalProperties": true
}
