{
  "$schema": "https://adjective.us/prelude/schemas/v1/constraints.schema.json",
  "version": "1.0.0",
  "mustUse": [
    "TypeScript for type safety",
    "TypeScript strict mode"
  ],
  "mustNotUse": [],
  "preferences": [],
  "codeStyle": {
    "linter": "ESLint"
  },
  "testing": {
    "required": true,
    "strategy": "Unit and integration tests"
  },
  "fileOrganization": [
    "All source code in src/ directory"
  ],
  "documentation": {
    "required": true,
    "style": "Markdown"
  }
}